{
  "$schema": "https://json-schema.org/draft/2020-12/schema",
  "$id": "https://ryoko.invalid/contracts/Profile.schema.json",
  "title": "Profile",
  "type": "object",
  "required": [
    "version",
    "nationality",
    "homeLanguage",
    "spokenLanguages",
    "diet",
    "dietNotes",
    "allergies",
    "favourites",
    "taste",
    "personality",
    "homeBase"
  ],
  "properties": {
    "version": {
      "type": "string",
      "pattern": "^[0-9a-f]{64}$",
      "description": "sha-256 (hex) of the canonical JSON of the profile without `version`"
    },
    "nationality": {
      "anyOf": [
        {
          "type": "string",
          "pattern": "^[A-Z]{2}$",
          "description": "ISO 3166-1 alpha-2 country code"
        },
        {
          "type": "null"
        }
      ]
    },
    "homeLanguage": {
      "type": "string",
      "pattern": "^[a-z]{2,3}(-[A-Za-z0-9]{2,8})*$",
      "description": "BCP-47 language tag, e.g. en, ja, zh-Hans"
    },
    "spokenLanguages": {
      "anyOf": [
        {
          "type": "array",
          "items": {
            "type": "string",
            "pattern": "^[a-z]{2,3}(-[A-Za-z0-9]{2,8})*$",
            "description": "BCP-47 language tag, e.g. en, ja, zh-Hans"
          },
          "maxItems": 10,
          "uniqueItems": true
        },
        {
          "type": "null"
        }
      ]
    },
    "diet": {
      "anyOf": [
        {
          "type": "array",
          "items": {
            "type": "string",
            "enum": [
              "vegetarian",
              "vegan",
              "halal",
              "kosher",
              "no_pork",
              "no_beef",
              "gluten_free",
              "lactose_free"
            ]
          },
          "uniqueItems": true
        },
        {
          "type": "null"
        }
      ]
    },
    "dietNotes": {
      "anyOf": [
        {
          "type": "string",
          "maxLength": 300
        },
        {
          "type": "null"
        }
      ]
    },
    "allergies": {
      "anyOf": [
        {
          "type": "array",
          "items": {
            "anyOf": [
              {
                "type": "object",
                "required": [
                  "id",
                  "severity"
                ],
                "properties": {
                  "id": {
                    "type": "string",
                    "enum": [
                      "egg",
                      "milk",
                      "mustard",
                      "peanut",
                      "crustacean_mollusc",
                      "fish",
                      "sesame",
                      "soy",
                      "sulphite",
                      "tree_nut",
                      "wheat"
                    ]
                  },
                  "severity": {
                    "type": "string",
                    "enum": [
                      "mild",
                      "serious",
                      "life_threatening"
                    ]
                  }
                },
                "additionalProperties": false
              },
              {
                "type": "object",
                "required": [
                  "id",
                  "label",
                  "severity"
                ],
                "properties": {
                  "id": {
                    "type": "string",
                    "enum": [
                      "custom"
                    ]
                  },
                  "label": {
                    "type": "string",
                    "minLength": 1,
                    "maxLength": 60,
                    "description": "Free-text allergen in the home language"
                  },
                  "severity": {
                    "type": "string",
                    "enum": [
                      "mild",
                      "serious",
                      "life_threatening"
                    ]
                  }
                },
                "additionalProperties": false
              }
            ]
          },
          "maxItems": 20
        },
        {
          "type": "null"
        }
      ]
    },
    "favourites": {
      "anyOf": [
        {
          "type": "object",
          "required": [
            "foods",
            "drinks"
          ],
          "properties": {
            "foods": {
              "type": "array",
              "items": {
                "type": "string",
                "minLength": 1,
                "maxLength": 60
              },
              "maxItems": 20
            },
            "drinks": {
              "type": "array",
              "items": {
                "type": "string",
                "minLength": 1,
                "maxLength": 60
              },
              "maxItems": 20
            }
          },
          "additionalProperties": false
        },
        {
          "type": "null"
        }
      ]
    },
    "taste": {
      "anyOf": [
        {
          "type": "object",
          "required": [
            "sweetness",
            "spice"
          ],
          "properties": {
            "sweetness": {
              "anyOf": [
                {
                  "type": "integer",
                  "minimum": 0,
                  "maximum": 4
                },
                {
                  "type": "null"
                }
              ]
            },
            "spice": {
              "anyOf": [
                {
                  "type": "integer",
                  "minimum": 0,
                  "maximum": 4
                },
                {
                  "type": "null"
                }
              ]
            }
          },
          "additionalProperties": false
        },
        {
          "type": "null"
        }
      ]
    },
    "personality": {
      "anyOf": [
        {
          "type": "object",
          "required": [
            "rhythm",
            "food",
            "budget",
            "vibe"
          ],
          "properties": {
            "rhythm": {
              "anyOf": [
                {
                  "type": "string",
                  "enum": [
                    "early_bird",
                    "night_owl"
                  ]
                },
                {
                  "type": "null"
                }
              ]
            },
            "food": {
              "anyOf": [
                {
                  "type": "string",
                  "enum": [
                    "local_favourite",
                    "my_usual"
                  ]
                },
                {
                  "type": "null"
                }
              ]
            },
            "budget": {
              "anyOf": [
                {
                  "type": "string",
                  "enum": [
                    "save",
                    "splurge"
                  ]
                },
                {
                  "type": "null"
                }
              ]
            },
            "vibe": {
              "anyOf": [
                {
                  "type": "string",
                  "enum": [
                    "quiet",
                    "lively"
                  ]
                },
                {
                  "type": "null"
                }
              ]
            }
          },
          "additionalProperties": false
        },
        {
          "type": "null"
        }
      ]
    },
    "homeBase": {
      "anyOf": [
        {
          "type": "object",
          "required": [
            "name",
            "coordinate"
          ],
          "properties": {
            "name": {
              "type": "string",
              "minLength": 1,
              "maxLength": 120
            },
            "localName": {
              "type": "string",
              "minLength": 1,
              "maxLength": 120
            },
            "address": {
              "type": "string",
              "minLength": 1,
              "maxLength": 240
            },
            "addressLocal": {
              "type": "string",
              "minLength": 1,
              "maxLength": 240
            },
            "coordinate": {
              "type": "object",
              "required": [
                "lat",
                "lon"
              ],
              "properties": {
                "lat": {
                  "type": "number",
                  "minimum": -90,
                  "maximum": 90
                },
                "lon": {
                  "type": "number",
                  "minimum": -180,
                  "maximum": 180
                }
              },
              "additionalProperties": false
            }
          },
          "additionalProperties": false
        },
        {
          "type": "null"
        }
      ]
    },
    "aboutMe": {
      "type": "string",
      "minLength": 1,
      "maxLength": 500,
      "description": "The traveller's own words about themselves; absent when empty"
    }
  },
  "additionalProperties": false
}
